{
  "$schema": "https://json-schema.org/draft/2020-12/schema",
  "$id": "https://terravisual.dev/schemas/infra-model.schema.json",
  "title": "InfraModel",
  "description": "The contract between analysis and presentation. The analyzer is its only producer; the layout, the diagram and the accessible tree are pure consumers. This schema is also the validation boundary for shared links, which carry untrusted data, so it is deliberately strict: no additional properties, explicit types, and bounded sizes throughout.",
  "type": "object",
  "additionalProperties": false,
  "required": [
    "schemaVersion",
    "nodes",
    "edges",
    "diagnostics",
    "stats"
  ],
  "properties": {
    "schemaVersion": {
      "description": "Consumers refuse a model they do not understand rather than misreading it.",
      "type": "integer",
      "const": 1
    },
    "nodes": {
      "type": "array",
      "maxItems": 20000,
      "items": {
        "$ref": "#/$defs/node"
      }
    },
    "edges": {
      "type": "array",
      "maxItems": 50000,
      "items": {
        "$ref": "#/$defs/edge"
      }
    },
    "diagnostics": {
      "type": "array",
      "maxItems": 5000,
      "items": {
        "$ref": "#/$defs/diagnostic"
      }
    },
    "stats": {
      "$ref": "#/$defs/stats"
    }
  },
  "$defs": {
    "node": {
      "type": "object",
      "additionalProperties": false,
      "required": [
        "id",
        "address",
        "type",
        "provider",
        "category",
        "label",
        "isContainer",
        "unplaced",
        "catalogued",
        "attributes",
        "source"
      ],
      "properties": {
        "id": {
          "$ref": "#/$defs/identifier"
        },
        "address": {
          "description": "The Terraform address, including any count or for_each key.",
          "type": "string",
          "maxLength": 512
        },
        "type": {
          "description": "Terraform resource type, or a synthetic type for containers the catalog introduces.",
          "type": "string",
          "maxLength": 128
        },
        "provider": {
          "type": "string",
          "maxLength": 64
        },
        "category": {
          "description": "Drives grouping and iconography. Open-ended on purpose: providers keep inventing categories.",
          "type": "string",
          "maxLength": 64
        },
        "label": {
          "description": "What the user sees. Derived from user input, so consumers must render it as text.",
          "type": "string",
          "maxLength": 256
        },
        "isContainer": {
          "type": "boolean"
        },
        "parentId": {
          "description": "Decided by the catalog, not by HCL: Terraform has no concept of containment. Absent when the node sits at the top level or could not be placed.",
          "$ref": "#/$defs/identifier"
        },
        "unplaced": {
          "description": "True when containment could not be determined, so the interface can group the node honestly instead of guessing a parent.",
          "type": "boolean"
        },
        "catalogued": {
          "description": "False for resource types the catalog does not know. These are still drawn, marked as uncatalogued: a real project must never look empty, nor look complete when it is not.",
          "type": "boolean"
        },
        "attributes": {
          "type": "object",
          "maxProperties": 500,
          "additionalProperties": {
            "$ref": "#/$defs/attribute"
          }
        },
        "expansion": {
          "$ref": "#/$defs/expansion"
        },
        "source": {
          "$ref": "#/$defs/range"
        },
        "modulePath": {
          "description": "The module this node was declared in, absent at the root. Recorded so the interface can say where a resource came from, and so containment can keep a module's contents together.",
          "type": "string",
          "maxLength": 512
        }
      }
    },
    "attribute": {
      "description": "Unknown is a first-class value. There is no ambiguous null or empty string standing in for 'not determinable', so the interface can always tell 'empty' from 'unknown'.",
      "type": "object",
      "additionalProperties": false,
      "required": [
        "known"
      ],
      "properties": {
        "known": {
          "type": "boolean"
        },
        "value": {
          "description": "Present only when known. Any JSON value, because Terraform attributes are.",
          "type": [
            "string",
            "number",
            "boolean",
            "object",
            "array",
            "null"
          ]
        },
        "reason": {
          "description": "Why the value could not be determined. Written for a learner: 'depends on a data source, which needs cloud credentials' teaches something; 'unknown' does not.",
          "type": "string",
          "maxLength": 512
        }
      }
    },
    "expansion": {
      "description": "Present when the node is one instance of a count or for_each block.",
      "type": "object",
      "additionalProperties": false,
      "required": [
        "kind"
      ],
      "properties": {
        "kind": {
          "enum": [
            "count",
            "for_each"
          ]
        },
        "index": {
          "type": "integer",
          "minimum": 0
        },
        "key": {
          "type": "string",
          "maxLength": 256
        },
        "total": {
          "description": "Absent when the instance count could not be determined.",
          "type": "integer",
          "minimum": 0
        },
        "truncated": {
          "description": "True when expansion hit a hard limit, so the interface can say the picture is partial.",
          "type": "boolean"
        }
      }
    },
    "edge": {
      "type": "object",
      "additionalProperties": false,
      "required": [
        "id",
        "from",
        "to",
        "kind",
        "drawn",
        "source"
      ],
      "properties": {
        "id": {
          "$ref": "#/$defs/identifier"
        },
        "from": {
          "$ref": "#/$defs/identifier"
        },
        "to": {
          "$ref": "#/$defs/identifier"
        },
        "kind": {
          "description": "Curated relationship type. Which relationships earn an edge is an editorial decision recorded in the catalog, not every reference in the code.",
          "type": "string",
          "maxLength": 64
        },
        "label": {
          "type": "string",
          "maxLength": 128
        },
        "source": {
          "$ref": "#/$defs/range"
        },
        "drawn": {
          "description": "Whether this relationship should appear in the diagram. The model carries every reference; the catalog decides which few teach something. A relationship recorded but not drawn is still available to search, explain and announce.",
          "type": "boolean"
        }
      }
    },
    "diagnostic": {
      "type": "object",
      "additionalProperties": false,
      "required": [
        "severity",
        "message",
        "source"
      ],
      "properties": {
        "severity": {
          "enum": [
            "error",
            "warning",
            "info"
          ]
        },
        "code": {
          "description": "Stable identifier so messages can be tested and translated without matching on prose.",
          "type": "string",
          "maxLength": 64,
          "pattern": "^[a-z0-9]+(-[a-z0-9]+)*$"
        },
        "message": {
          "type": "string",
          "maxLength": 2048
        },
        "source": {
          "$ref": "#/$defs/range"
        }
      }
    },
    "range": {
      "description": "Present on nodes, edges and diagnostics alike. This is what makes bidirectional code and diagram navigation possible.",
      "type": "object",
      "additionalProperties": false,
      "required": [
        "file",
        "startLine",
        "startCol",
        "endLine",
        "endCol"
      ],
      "properties": {
        "file": {
          "type": "string",
          "maxLength": 1024
        },
        "startLine": {
          "type": "integer",
          "minimum": 0
        },
        "startCol": {
          "type": "integer",
          "minimum": 0
        },
        "endLine": {
          "type": "integer",
          "minimum": 0
        },
        "endCol": {
          "type": "integer",
          "minimum": 0
        }
      }
    },
    "stats": {
      "type": "object",
      "additionalProperties": false,
      "required": [
        "files",
        "resources",
        "durationMs",
        "truncated"
      ],
      "properties": {
        "files": {
          "type": "integer",
          "minimum": 0
        },
        "resources": {
          "type": "integer",
          "minimum": 0
        },
        "durationMs": {
          "type": "integer",
          "minimum": 0
        },
        "truncated": {
          "description": "A hard limit was reached. The interface must say so rather than presenting a partial picture as a complete one.",
          "type": "boolean"
        }
      }
    },
    "identifier": {
      "type": "string",
      "minLength": 1,
      "maxLength": 512
    }
  }
}
